{
  "edges": [
    {
      "from": "step:research_sweep",
      "to": "artifact:artifacts/strategies/robustness/cross_section_momentum_robustness_cdc41eefec52",
      "type": "produces"
    }
  ],
  "nodes": [
    {
      "id": "artifact:artifacts/strategies/robustness/cross_section_momentum_robustness_cdc41eefec52",
      "metadata": {
        "manifest_path": "artifacts/strategies/robustness/cross_section_momentum_robustness_cdc41eefec52/manifest.json",
        "path": "artifacts/strategies/robustness/cross_section_momentum_robustness_cdc41eefec52"
      },
      "type": "artifact"
    },
    {
      "id": "step:research_sweep",
      "metadata": {
        "module": "src.cli.run_strategy",
        "status": "completed"
      },
      "outputs": {
        "artifact_dir": "artifacts/strategies/robustness/cross_section_momentum_robustness_cdc41eefec52",
        "manifest_path": "artifacts/strategies/robustness/cross_section_momentum_robustness_cdc41eefec52/manifest.json",
        "name": "cross_section_momentum",
        "output_paths": {
          "equity_curve_csv": "artifacts/strategies/robustness/cross_section_momentum_robustness_cdc41eefec52/equity_curve.csv",
          "manifest_json": "artifacts/strategies/robustness/cross_section_momentum_robustness_cdc41eefec52/manifest.json",
          "metrics_json": "artifacts/strategies/robustness/cross_section_momentum_robustness_cdc41eefec52/metrics.json",
          "qa_summary_json": "artifacts/strategies/robustness/cross_section_momentum_robustness_cdc41eefec52/qa_summary.json"
        },
        "result_type": "RobustnessRunResult",
        "run_id": "cross_section_momentum_robustness_cdc41eefec52",
        "status": "completed",
        "strategy_name": "cross_section_momentum"
      },
      "type": "step"
    }
  ],
  "pipeline_run_id": "m21_robustness_scenario_sweep_pipeline_6a7442225a97",
  "run_type": "pipeline_lineage",
  "schema_version": 1
}